{
  "account": "後期高齢者医療会計",
  "total_label": [
    "歳",
    "出",
    "合",
    "計"
  ],
  "parent_amounts": [
    "当初予算額",
    "補正予算額",
    "継続費及び繰越事業費繰越額",
    "予備費支出及び流用増減",
    "計",
    "支出済額",
    "翌年度繰越額",
    "不用額"
  ],
  "amount_edges": [
    [
      142,
      216
    ],
    [
      218,
      290
    ],
    [
      290,
      350
    ],
    [
      350,
      413
    ],
    [
      415,
      482
    ],
    [
      728,
      792
    ],
    [
      794,
      862
    ],
    [
      864,
      925
    ]
  ],
  "setsu_amount_edge": [
    640,
    722
  ],
  "setsu_name_zone": [
    480,
    600
  ],
  "setsu_event_x": [
    480,
    550
  ],
  "kan_name_x": [
    40,
    66
  ],
  "kou_name_x": [
    60,
    80
  ],
  "moku_name_x": [
    88,
    150
  ],
  "note_left": 925,
  "uchiwake_reason": "備考欄の経費内訳（□事業・○経費・積算）は原文のまま目_備考へ保持し、節との対応が未確認のため行化しない。注記の語を含む行以降は範囲に含めない。",
  "body_top": 150,
  "body_bottom": 770,
  "total_carry_labels": [
    "繰越明許費",
    "事故繰越し",
    "継続費逓次繰越"
  ],
  "metadata_note": "武蔵野市後期高齢者医療会計の決算事項別明細書（歳出）。款・項・目の印字欄を所属する葉へ反復。最細は法定節（節がない予備費目は目）。節一覧と備考は同じ目の独立した分解であり相互の対応を推定していない。目_備考は目の備考欄の原文（□事業・○経費・積算）。金額は円の原表記（△は減額符号）。歳出合計はlocal観測に残しraw行にしない。"
}
